{
  "grid": {
    "rows": 5,
    "cols": 5,
    "cells": [
      [
        {
          "row": 0,
          "col": 0,
          "value": 1,
          "blocked": false,
          "given": true
        },
        {
          "row": 0,
          "col": 1,
          "value": null,
          "blocked": false,
          "given": false
        },
        {
          "row": 0,
          "col": 2,
          "value": null,
          "blocked": false,
          "given": false
        },
        {
          "row": 0,
          "col": 3,
          "value": null,
          "blocked": false,
          "given": false
        },
        {
          "row": 0,
          "col": 4,
          "value": null,
          "blocked": false,
          "given": false
        }
      ],
      [
        {
          "row": 1,
          "col": 0,
          "value": null,
          "blocked": false,
          "given": false
        },
        {
          "row": 1,
          "col": 1,
          "value": null,
          "blocked": false,
          "given": false
        },
        {
          "row": 1,
          "col": 2,
          "value": null,
          "blocked": false,
          "given": false
        },
        {
          "row": 1,
          "col": 3,
          "value": 7,
          "blocked": false,
          "given": true
        },
        {
          "row": 1,
          "col": 4,
          "value": null,
          "blocked": false,
          "given": false
        }
      ],
      [
        {
          "row": 2,
          "col": 0,
          "value": null,
          "blocked": false,
          "given": false
        },
        {
          "row": 2,
          "col": 1,
          "value": null,
          "blocked": false,
          "given": false
        },
        {
          "row": 2,
          "col": 2,
          "value": 13,
          "blocked": false,
          "given": true
        },
        {
          "row": 2,
          "col": 3,
          "value": null,
          "blocked": false,
          "given": false
        },
        {
          "row": 2,
          "col": 4,
          "value": null,
          "blocked": false,
          "given": false
        }
      ],
      [
        {
          "row": 3,
          "col": 0,
          "value": null,
          "blocked": false,
          "given": false
        },
        {
          "row": 3,
          "col": 1,
          "value": 19,
          "blocked": false,
          "given": true
        },
        {
          "row": 3,
          "col": 2,
          "value": null,
          "blocked": false,
          "given": false
        },
        {
          "row": 3,
          "col": 3,
          "value": null,
          "blocked": false,
          "given": false
        },
        {
          "row": 3,
          "col": 4,
          "value": null,
          "blocked": false,
          "given": false
        }
      ],
      [
        {
          "row": 4,
          "col": 0,
          "value": null,
          "blocked": false,
          "given": false
        },
        {
          "row": 4,
          "col": 1,
          "value": null,
          "blocked": false,
          "given": false
        },
        {
          "row": 4,
          "col": 2,
          "value": null,
          "blocked": false,
          "given": false
        },
        {
          "row": 4,
          "col": 3,
          "value": null,
          "blocked": false,
          "given": false
        },
        {
          "row": 4,
          "col": 4,
          "value": 25,
          "blocked": false,
          "given": true
        }
      ]
    ]
  },
  "constraints": {
    "min_value": 1,
    "max_value": 25,
    "allow_diagonal": true,
    "must_be_connected": true
  },
  "difficulty": "easy",
  "metadata": {
    "seed": 42,
    "path_mode": "serpentine",
    "clue_mode": "even",
    "difficulty": "easy",
    "size": [
      5,
      5
    ],
    "num_givens": 5,
    "timings_ms": {
      "total": 0.0
    },
    "generated_at": "2025-11-04 13:15:23",
    "exported_at": "2025-11-04T13:15:23.020035"
  }
}